{
    "system": "eu-lobbying",
    "disclosure_id": "9218245390-27",
    "field": "goals",
    "text": "Die Interessen der deutschen Brauwirtschaft gegenüber den Institutionen der Europäischen Union vertreten.",
    "source_lang": "de",
    "source_lang_origin": "detected",
    "detected_by": "nebius:deepseek-ai/DeepSeek-V4-Flash-0731",
    "summaries": {
        "de": "Vertritt die deutsche Brauwirtschaft bei der EU.",
        "en": "Represents the German brewing industry at the EU."
    },
    "method": "linguistics:nebius",
    "summarized_at": "2026-10-09T12:00:00Z"
}
